id,title,content,date_published,accident_datetime,street,city,A_accident_severity,A_driver_age,A_driver_gender,A_number_injured,A_vehicle_type,B_accident_severity,B_driver_age,B_driver_gender,B_number_injured,B_vehicle_type,C_accident_severity,C_driver_age,C_driver_gender,C_number_injured,C_vehicle_type,D_accident_severity,D_driver_age,D_driver_gender,D_number_injured,D_vehicle_type,accident_date_id,accident_severity,total_injured,C_city,C_street,accident_time_category,accident_time_afternoon,accident_time_early_morning,accident_time_evening,accident_time_late_evening,accident_time_morning,accident_time_night,driver_under_18,driver_18_to_24,driver_25_to_49,driver_50_to_64,driver_65_plus,num_drivers_under_18,num_drivers_18_to_24,num_drivers_25_to_49,num_drivers_50_to_64,num_drivers_65_plus,driver_male,driver_female,driver_unknown,num_drivers_male,num_drivers_female,num_drivers_unknown,num_drivers_total,vehicle_unknown,vehicle_pedestrian,vehicle_bicycle,vehicle_motorbike,vehicle_car,vehicle_van,vehicle_bus,num_vehicle_unknown,num_vehicle_pedestrian,num_vehicle_bicycle,num_vehicle_motorbike,num_vehicle_car,num_vehicle_van,num_vehicle_bus,is_weekend,is_public_holiday_mt,is_school_holiday_mt,is_school_day_mt,street_latitude,street_longitude,street_type,street_type_other,street_type_primary,street_type_residential,street_type_secondary,street_type_tertiary,street_type_trunk,region,region_Central,region_Gozo,region_Northern,region_South Eastern,region_Southern Harbour
article_3834.0,"Driver paid for damages he was never accused of causing, court hears","A driver who was conditionally discharged over a collision that took place 18 years ago, paid for damages to the other driverâ€™s vehicle when he was never charged with causing such damages but only for injuries suffered by that driverâ€™s passenger. Emanuel Gatt was targeted by criminal charges following the accident which took place in Triq il-Mithna, Qormi on December 17, 2006 when he was involved in a collision which resulted in grievous injuries to a woman in the other car. Gatt was subsequently prosecuted for careless and dangerous driving, driving under the influence of alcohol or drugs, having an alcohol level beyond the legal limits as well as causing grievous injuries to the woman. The proceedings dragged on until earlier this year, when the case was assigned to a new magistrate. Eighteen years down the line, Gatt registered an admission to three of the charges, including that related to the injuries involuntarily caused to the victim. When examining the evidence to determine whether Gatt was guilty of the other charges the court, presided over by Magistrate Donatella Frendo Dimech, observed that the only witness who testified in the proceedings was a medical doctor who confirmed that the victim fractured a left-hand finger. She also suffered neck and shoulder injuries. The injuries were classified as grievous because of the fracture Despite the fact that the doctor was the only witness, the proceedings dragged on for 17 years. A court minute dated March 28, 2008 indicated that the driver of the other car had claimed damages to the tune of â‚¬1700. That amount included court expenses. But what was most concerning was the fact that his name was not even mentioned in that court minute. Much less so did he testify, observed the magistrate when delivering judgment. Nor was there any receipt or a single scrap of documentary evidence to support his claim for damages. Yet, while the case dragged on, the accused made â‚¬300 payments to someone named Etienne Bugeja. He appeared to be a relative of the victim and was driving the car at the time of the crash. That fact was understood through the police current incident report which, however, was never confirmed on oath. The magistrate was â€œmost astonishedâ€ by the fact that the court, as previously presided, had permitted such payments for damages allegedly caused to Bugejaâ€™s car when the accused was never charged with causing damage to third party property but only for injuring the passenger. And although he claimed damages totalling â‚¬1700, Bugeja was never even formally identified in the court records. In light of such evidence and the circumstances of the case, the court cleared Gatt of the other charges whilst conditionally discharging him for 40 months over those charges he pleaded guilty to. When meting out punishment, the court took into consideration Gattâ€™s criminal record and the fact that the case had â€œinexplicablyâ€ dragged on for 17 years. The court also imposed a three-month driving ban.",30/12/2024,2006-12-17 00:00:00,triq il-mithna,qormi,Grievious,Unknown,Unknown,1,Car,not injured,Unknown,M,0,Car,,,,,,,,,,,20061217,Grievious,1,qormi,triq il-mithna,night,False,False,False,False,False,True,False,False,False,False,False,0,0,0,0,0,True,False,True,1,0,1,2,False,False,False,False,True,False,False,0,0,0,0,2,0,0,True,False,False,False,35.8830183,14.4734016,secondary,False,False,False,True,False,False,Central,True,False,False,False,False
article_2101.0,Driver jailed for four years for killing passenger in 2017 car crash,"A 48-year-old man has been jailed for four years for causing the death of a passenger in his car during a collision in August 2017. St Paulâ€™s Bay resident Godfrey Gambin was charged with the involuntary homicide of Jane Mary Turner, 45. He was also accused of causing involuntary bodily harm on another driver, causing damages to the other car and violating traffic rules. Police sergeant Denise Camilleri told the court that she was stationed at Mosta Police Station on August 20 2017 when she got the call about a collision on Triq Sir Temi Zammit in MÄ¡arr. The sergeant went on site and found Gambinâ€™s car had overturned, the driver was standing outside and had blood over him. Turner, who was inside Gambinâ€™s car, died on site. The other vehicle was on the pavement in the opposite direction. Gambin was hospitalised and was in intensive care for some time. The other driver told the court that he was going to GÄ§adira and was driving towards MÄ¡arr when he saw an oncoming car coming in the opposite direction in his lane. He had no time to avoid the collision and Gambin crashed his vehicle into the manâ€™s car.  The vehicle spun twice before ending up on the pavement. The windscreen shattered. The driver recalled that when he got out of his car, he found Gambinâ€™s car overturned and the female passenger dead on site. The court, presided over by magistrate Caroline Farrugia Frendo, found Gambin guilty and jailed him for four years. He was fined â‚¬11,600 and his driving licence was suspended for three months as from 2 April 2025. Gambin was also ordered to pay â‚¬2,975.91 in court expenses. Inspector Godwin Scerri prosecuted.",01/04/2025,2017-08-20 15:25:00,triq sir temi zammit,mgarr,Unknown,26,M,1,car,Fatal,41,M,2,car,,,,,,,,,,,20170820,Fatal,3,mgarr,triq sir temi zammit,afternoon,True,False,False,False,False,False,False,False,True,False,False,0,0,2,0,0,True,False,False,2,0,0,2,False,False,False,False,True,False,False,0,0,0,0,2,0,0,True,False,True,False,35.9240642,14.3752357,secondary,False,False,False,True,False,False,Northern,False,False,True,False,False
article_353524.0,Elderly man acquitted of traffic fatality as victim is blamed,"A man has been acquitted of causing the death of a pedestrian in Paola in 2018 after finding that the victim caused the incident through negligence and the motorist could do nothing about it. The accident happened at Triq Wied Bladun on May 13, 2018. George Glanville, now 83, from Fgura was accused of having caused the death of his friend, William Cocker. The court heard that on that day, Glanville was driving his Kia Rio on a clear road. The traffic light was green. Behind him a man rode a motorcycle accompanied by a passenger. Cocker suddenly emerged from behind a wall and attempted to cross the road straight in front of Glanvilleâ€™s car. Glanville told the police he was driving at 40-50 km/hr and stopped the vehicle immediately the accident happened. He got out of his car and spoke to Cocker who was still responsive. He only left the scene after the police allowed him to. Glanville told the police that he was sorry for what had happened, since Cocker was his friend and he had known him for a long time. He also kept visiting Cocker in hospital every two days until his death on May 31. Â  The motorcyclist who had been following Glanville testified that Cocker just crossed the road suddenly. Glanville hit the pedestrian and stopped the car immediately. The man recalled assisting the driver and the victim, who were two elderly men and knew each other. Another eyewitness said that the pedestrian was crossing on the pedestrian crossing when the lights were green for vehicles. Superintendent Hubert Cini testified that Cockerâ€™s injuries were certified as grievous; however, he was not seen at risk of dying at the time. A post-mortem investigation determined, however, that Cockerâ€™s death was a result of the incident. In their submissions on punishment, the prosecution said the charges were issued after the post-mortem examination showed that the victimâ€™s death was caused by the incident. It also argued that while the pedestrian crossed when the lights were green for vehicles, the driver failed to keep a proper lookout. The defence countered that the victim crossed the road without proper look-out when he should not have even crossed. The driver had no time to react. The court referred to the eyewitnesses who testified how Cocker just crossed the road without waiting for the red lights for vehicles. From their testimony, it emerged that the accused could not reasonably have avoided the incident. The court said that it was convinced that the accused was driving responsibly. The evidence showed that the victim had been negligent in this case and that it led to the unfortunate incident. â€œFor this reason, one cannot say that the accused did not keep a proper look out since the victimâ€™s action was unpredictable and there was nothing that the accused could have done to avoid the incident,â€ Magistrate Nadine Sant Lia observed. The court ruled that the incident was caused by Cockerâ€™s imprudence, which created an unpredictable emergency that made it impossible and unreasonable for the accused to take timely action and avoid the incident. Glanville was acquitted of having caused Cockerâ€™s death through negligent driving. Magistrate Nadine Sant Lia presided over the case. Superintendent Hubert Cini prosecuted.",23/07/2025,2018-03-13 00:00:00,triq wied bladun,paola,Fatal,83,M,0,Car,Fatal,none,M,1,Pedestrian,,,,,,,,,,,20180313,Fatal,1,paola,triq wied bladun,night,False,False,False,False,False,True,False,False,False,False,True,0,0,0,0,1,True,False,False,2,0,0,2,False,True,False,False,True,False,False,0,1,0,0,1,0,0,False,False,False,True,35.87264,14.50788,residential,False,False,True,False,False,False,Southern Harbour,False,False,False,False,True
article_1352.0,"Motorcyclist injured in pothole incident awarded â‚¬74,000","A 39-year-old Turkish national has been awarded over â‚¬74,000 in damages following an accident in SiÄ¡Ä¡iewi which left him suffering from a permanent disability. The man was driving his Piaggio Vespa along Triq GÄ§ar Lapsi on May 2, 2020, when he stumbled into a pothole, lost his balance and fell off the motorcycle. He was taken to Mater Dei Hospital where he was certified with grievous injuries. Following the incident, the man returned to Turkey since he needed treatment, and the coronavirus pandemic had hit. He also underwent several surgical interventions. As a result of the incident, he sustained permanent disability, which harmed his quality of life. The man eventually returned to Malta. Through his lawyers, he filed an application before the First Hall of the Civil Court, suing the SiÄ¡Ä¡iewi Local Council and Infrastructure Malta. He requested the court to hold both responsible for the incident and order them to pay him damages. Both Infrastructure Malta and the SiÄ¡Ä¡iewi local council argued that they were not suited, with the road agency arguing that the council was responsible for maintaining the road, while the local council argued that it was in the hands of the agency. In court, the man testified that as he was driving along Triq GÄ§ar Lapsi, direction towards Dingli cliffs, a few meters after he turned the corner, the condition of the road changed dramatically. Who is responsible for the road? He described how the road level went down by a few metres before he drove into a pothole. Moreover, there were no signs that the road surface would deteriorate, and the man said he had no reason to believe that the road surface would change in such a manner. John Fenech from Elles Urban Services Ltd â€“ a company engaged by the council to maintain the roads â€“ acknowledged that the road was in a state of disrepair and it had to be resurfaced. He also testified that the damage to the road was primarily attributable to the frequent passage of heavy vehicles in the service of nearby quarries. He added that the road was not built to take the weight of the vehicles. A police constable similarly testified that the road was in a bad state, noting that there were several cracks in the asphalt and potholes. In establishing who was responsible for the road, the court heard architect David Vassallo from Infrastructure Malta. The witness said the road fell under the responsibility of the local council, however, the road agency intervened and issued an emergency allocation to contractor Philip Agius and Sons for â‚¬1.5 million, excluding VAT, in December 2020. The councilâ€™s executive secretary, Ritianne Giorgino, told the court that while it was within the councilâ€™s boundary, the local council is responsible for maintenance or patching works, while resurfacing falls under the responsibility of the local government. Referring to the mayorâ€™s affidavit, the court observed that while it was outlined that the council has several structures to monitor and ascertain that roads are kept in a good state of repair, this was not the case and notwithstanding the â€œlayers of surveillance adopted by the Council, somewhere down the line, somebody is not doing his job properly or else the technical operandi is not functioning."" The court reminded how the road is used by heavy vehicles and therefore, the road should have been monitored more closely and frequently. It also observed that it was only after the plaintiff was injured that the road was properly repaired. The court concluded that the council was wholly to blame for the accident.Â  When it came to calculating damages, it took into consideration that 21 months after the accident, the manâ€™s radial nerve did not make a full recovery, and this was most likely improbable. It also took into consideration the court-appointed expertâ€™s observations on the fracture of the distal tibia, which involved an articular surface of the ankle joint and will inevitably lead to arthritic change. The motorcyclist also ended up with substantial amounts of metal implants attached to the humerus and tibia. These foreign bodies provide a slightly increased risk of bone infection during bacetermia, according to the expert. After calculating the damages, the court declared the SiÄ¡Ä¡iewi local council responsible for the incident and ordered it to pay the man â‚¬74,873. Mr Justice Toni Abela presided over the court. Lawyers Kris Busietta and Alessandro Farrugia assisted the plaintiff.",09/05/2025,2020-05-02 08:00:00,triq ghar lapsi,siggiewi,Serious,39,M,1,Motorbike,,,,,,,,,,,,,,,,20200502,Serious,1,siggiewi,triq ghar lapsi,early_morning,False,True,False,False,False,False,False,False,True,False,False,0,0,1,0,0,True,False,False,1,0,0,1,False,False,False,True,False,False,False,0,0,0,1,0,0,0,True,False,False,False,35.83321,14.43274,secondary,False,False,False,True,False,False,Central,True,False,False,False,False
article_490632.0,â€˜Why do we have to beg for justice?â€™,"The brother of a food courier killed in a freak accident more than three years ago is appealing for justice as the magisterial inquiry is still ongoing. In February 2022, 28-year-old Nepali delivery driver Ajay Shrestha died when a truck overturned on Marsaâ€™s Aldo Moro Road. The vehicle ploughed into a lamppost before spilling its load of scrap metal onto oncoming traffic, fatally crushing Shrestha. Shrestha, known to friends as â€˜AJâ€™, had moved to Malta from Nepal in 2018 in search of work. Just a week before the accident, he had celebrated his 28th birthday. â€œIt has been three years now since my brotherâ€™s death, and nothing has happened. Nobody has contacted me,â€ Ajayâ€™s older brother, Anil, told Times of Malta.  Anil recalled how his sibling always had a smile on his face and, during his time in Malta, made a lot of friends. â€œHe was very passionate about sport, he played cricket back at home and loved to play music. He was never angry with anyone and was just a very good person.â€ He said the two were always together from childhood until the fatal accident changed that. â€œAll my family wants is justice for Ajay. We understand that it was an accident, but we deserve and need this justice and to know that someone is looking into my brotherâ€™s case.â€",17/08/2025,2022-02-01 00:00:00,aldo moro road,marsa,Fatal,28,M,1,Motorbike,Fatal,none,none,0,van,,,,,,,,,,,20220201,Fatal,1,marsa,aldo moro road,night,False,False,False,False,False,True,False,False,True,False,False,0,0,1,0,0,True,False,True,1,0,1,2,False,False,False,True,False,True,False,0,0,0,1,0,1,0,False,False,False,True,35.8772393,14.4948062,trunk,False,False,False,False,False,True,Southern Harbour,False,False,False,False,True
article_3861.0,Mother calls for stricter penalties after sonâ€™s road death,"The mother of a 21-year-old man who died in a traffic accident two years ago believes the courts are too lenient in suspending the licences of drivers responsible for serious or fatal collisions. Fiona Laferlaâ€™s son, Ben, was a passenger in a rental car driven by his friend, Maxime Asacha Muehlematter, when it crashed into a wall on Triq il-Madliena in Swieqi. Last month, Muehlematter received a suspended jail sentence and a one-year driving ban after admitting to involuntarily causing Benâ€™s death on September 24, 2022. Maltese traffic regulations stipulate a minimum driving ban of six months to a year, with courts having discretion over the final length based on the specific circumstances.  Lingering questions In court, it emerged that the front seatbelts were elongated but those at the back were stiff, indicating Ben and Flo had not been wearing them. After the crash, first aiders found Ben outside the car. A passer-by pulled him out to try to help. Maxâ€™s 17-year-old girlfriend initially claimed she was driving. She later admitted she lied, thinking her age would protect her from charges. She received a conditional discharge. A bottle of rum and another bottle of alcohol was found in the car, leading to public assumptions about the groupâ€™s behaviour. Fiona derides the â€œcallous commentsâ€ and clarifies that Ben had had the bottle of rum for weeks. Fiona remains unconvinced about the reported speed of 35km/hr, noting that Benâ€™s injuries seemed too severe. â€œYou know how many times my sister and I tried taking a sudden break at that speed to try to understand? I know that stupid things happen. In this case, there was a wall. But there are still questions.â€ The mother says the car safety element was never explored during the court case. â€œThere is always a fault â€“ but there are other things to consider that go beyond the driver: is the car properly maintained? Is the road too dark?â€ Fiona was hoping the court case would give her the answers. It did not, and she found it painful when a defence lawyer attempted to discredit Ben and Flo, even though they were sitting at the back. In the end, following a change of lawyer, Max admitted to causing Benâ€™s death. The prosecution withdrew charges relating to reckless and negligent driving as well as driving under the influence, because there was no material evidence that could lead to a conviction. â€œI wasnâ€™t hoping Max goes to prison because I wasnâ€™t out for vengeance. I donâ€™t want to persecute the boy. Ben loved him. He was his friend. That was meant to be down the road and coming back. You donâ€™t think itâ€™s going to happen to youâ€¦ Just because Ben is not here doesnâ€™t mean Max cannot have a life.â€ And now, Fiona says, her mission is to keep Benâ€™s memory alive. One way of doing it by promoting a â€˜Ben Lafestaâ€™ charity event, among other events in the pipeline. â€œThat keeps me going,â€ she says.",29/12/2024,2022-09-24 00:00:00,triq il-madliena,swieqi,Fatal,22,M,1,Car,,,,,,,,,,,,,,,,20220924,Fatal,1,swieqi,triq il-madliena,night,False,False,False,False,False,True,False,True,False,False,False,0,1,0,0,0,True,False,False,1,0,0,1,False,False,False,False,True,False,False,0,0,0,0,1,0,0,True,False,False,False,35.92788,14.48096,primary,False,True,False,False,False,False,Northern,False,False,True,False,False
article_167578.0,"Motorist fined â‚¬4,000 after grievously injuring woman using pelican crossing","A motorist has been fined â‚¬4,000 after being found guilty of grievously injuring a pedestrian after he crashed into a car waiting at a pelican crossing, sending it smashing into a woman crossing the road. St Paulâ€™s Bay resident Jithu James, 32, was accused of driving a vehicle in a dangerous, negligent and reckless manner and grievously injuring a pedestrian in an incident that occurred in October 2023. A motorist who was on his way home from work at the time of incident, explained he had been waiting for pedestrians to cross a pelican crossing on December 13 Road when he saw a vehicle being driven at an â€œabnormalâ€ speed. The speeding vehicle crashed into the witnessâ€™ car, which in turn hit a pedestrian using the crossing. The witness exited his vehicle, called the emergency services and went to assist a woman who was lying on the ground. In his testimony, he recalled that she was not in a â€œgoodâ€ state. Under cross-examination he confirmed he had stopped but not pulled up his handbrake. He also confirmed he had not been charged in connection with the incident. Another witness, who had been using the crossing at the time of the incident, explained he had been crossing the road with his dog, with a woman walking next to him. Two cars had been waiting for pedestrians to finish using the crossing, he recalled, when a third car crashed into one of the stationary cars. He added that his dog lost a tooth in the crash. The man remained with the woman until the ambulance came. The court in its considerations held that James failed to maintain a proper lookout while driving, especially when approaching a pedestrian crossing. The man was fined â‚¬4,000 and had 10 points knocked off his licence. He was disqualified from holding a driving licence for three months. Magistrate Yana Micallef Stafrace presided.",15/07/2025,2023-10-01 00:00:00,december 13 road,st paul's bay,Grievious,32,M,0,Car,Grievious,none,M,0,Car,Grievious,none,F,1.0,Pedestrian,,,,,,20231001,Grievious,1,san pawl il bahar,triq dicembru tlettax,night,False,False,False,False,False,True,False,False,True,False,False,0,0,1,0,0,True,True,False,2,1,0,3,False,True,False,False,True,False,False,0,1,0,0,2,0,0,True,False,False,False,35.8786271,14.4913829,trunk,False,False,False,False,False,True,Northern,False,False,True,False,False
article_3558.0,â€˜Donâ€™t give upâ€™: Isabelle Bonnici urges father seeking answers for sonâ€™s death,"Isabelle Bonnici, the mother of construction victim Jean Paul Sofia, has urged a Danish father seeking answers about his son's tragic death not to give up on advocating for his son.Â  Lars Neidhardt told Times of Malta that over a year since his son died in Malta in a traffic collision, he has been left in the dark by Maltese authorities.Â  Asger Emil Neidhard was a 25-year-old IT entrepreneur who came to Malta in October 2023 to enjoy a holiday with friends.Â Six days later, he diedÂ after he was hit by a Honda Accord driven by a 44-year-old man in the Regional Road tunnels. â€œTen days after the accident, my son arrived in Denmark in a coffin, and we never heard from the Maltese authorities about what happened to him,â€ Neidhardt said.Â  â€œItâ€™s very frustrating to lose oneâ€™s child and not know what happened. Is the case being investigated? Is the driver facing any consequences? We are completely left in the dark.â€  While many commenters expressed solidarity with the father and others speculated that achieving justice would be a long and thankless journey that may not even be successful, one voice of encouragement stood out from the rest.Â  Bonnici urged Neidhardt not to give in to negativity and keep fighting to seek the truth about his son's death.Â  ""Don't give up on getting justice for your son! Keep voicing your frustration, keep emailing, get the media, do whatever it takes... just don't give up!"" she said.Â  ""Not giving up gives others the courage to fight for their rights! If we all give up because of the so many injustices around us we will be giving power to the bullies! Let's not give more power to injustice but fight for more power to justice!"" Bonnici's son, Jean Paul Sofia, died when a building collapsed in Corradino in December 2022 in an incident that left five other people injured.Â  Her tenacity and relentlessness in campaigning for justice for her son made Bonnici a household name, as she stood outside parliament and regularly confronted MPs about Jean Paul's case.Â  Despite the government's refusal to order a public inquiry into the incident, Bonnici continued to campaign vociferously and mobilised so much public support that Prime Minister Robert Abela was forced to u-turn on the decision, announcing the inquiry just moments before a crowd of thousands turned up in Valletta for a protest vigil.Â  The inquiry led to an ongoing reform in the construction industry, with Bonnici regularly speaking out about issues in the sector.",16/01/2025,2023-10-22 22:00:00,regional road,st julian's,Fatal,25,M,1,Pedestrian,not injured,44,M,0,Car,,,,,,,,,,,20231022,Fatal,1,st julian,regional road,late_evening,False,False,False,True,False,False,False,False,True,False,False,0,0,2,0,0,True,False,False,2,0,0,2,False,True,False,False,True,False,False,0,1,0,0,1,0,0,True,False,False,False,35.9034355,14.4867323,trunk,False,False,False,False,False,True,Northern,False,False,True,False,False
article_495320.0,Woman cleared of causing collision with six parked cars,"A court has cleared a woman of crashing a car into six parked vehicles after the prosecution failed to prove she was the driver. The incident happened in Naxxar Road, Birkirkara, on March 19, 2022. Esther Mifsud was arraigned before Magistrate Yana Micallef Stafrace and accused of dangerous and reckless driving, damaging the six parked cars due to negligence, and driving under the influence of alcohol. She denied the charges. The court observed that affidavits presented in court were â€œinconclusiveâ€ and â€œconfusingâ€ as to who was actually driving the vehicle at the time of the incident. It pointed out that jurisprudence laid down that the evidence on identity needs to be â€œclearâ€ and â€œunequivocalâ€. In this case the prosecution failed to prove beyond a reasonable doubt that the accused was driving the vehicle at the time of the incident and that she was driving under the influence. It was also noted that while the police had alleged that bodycam used by officers on the scene was switched on at the time of the incident, footage was never presented in court. â€œHad this evidence been presented, it would clearly have helped the court to identify the person behind the wheel,â€ Magistrate Yana Micallef Stafrace said. The court acquitted Mifsud of all charges brought against her.</p><p>Police inspector Diane Vella prosecuted. Lawyer Charles Mercieca appeared for the accused.",30/09/2025,2024-03-19 00:00:00,naxxar road,birkirkara,not injured,none,F,0,car,,,,,,,,,,,,,,,,20240319,not injured,0,birkirkara,naxxar road,night,False,False,False,False,False,True,False,False,False,False,False,0,0,0,0,0,False,True,False,0,1,0,1,False,False,False,False,True,False,False,0,0,0,0,1,0,0,False,True,False,False,35.8980141,14.4596416,primary,False,True,False,False,False,False,Central,True,False,False,False,False
article_495942.0,Traffic collision case collapses over identification failure and police error,"A St Paulâ€™s Bay man accused of causing a traffic collision has been acquitted after the alleged victim failed to identify him in court and police failed to follow proper procedures during the investigation. Dennis Attard, 49, of Triq l-Imsida, Santa Venera, faced five charges stemming from a collision on 23 September 2024 in Triq Censu Tabone, St Paulâ€™s Bay, including reckless driving, causing involuntary damage, driving without a licence, driving an unlicensed vehicle, and driving without insurance. The case centred on a collision between Attardâ€™s vehicle and a motorcycle ridden by Marland Herman Jones. Jones told the court he was riding down a narrow street when a car â€œjust kind of jumped inâ€ and pulled out in front of him. â€œI braked as hard as I could but I hit the I believe his door or the front right quarter panel,â€ he testified, adding that he â€œjust kind of fell over and jumped up cursing.â€ Jones explained that the driver claimed he had to leave urgently because â€œhis daughter was giving birth.â€ They exchanged phone numbers via WhatsApp, but when Jones attempted to contact him, he received no response despite seeing the messages had been viewed. â€œI tried to contact him again, no answer. He viewed the I saw it through the messaging app. I could tell that he watched it,â€ Jones testified. However, when asked to identify the accused in court, Jones admitted: â€œActually at at this date I canâ€™t recognize him in court, if this is the gentleman, I donâ€™t quite recognize him, I have to be honest.â€ He explained he had identified someone at the police station â€œover 8 months agoâ€ but â€œcouldnâ€™t tell you now.â€ The defence suggested Jones had hit the car from behind, but Jones firmly rejected this, stating repeatedly: â€œThatâ€™d be completely incorrectâ€ and â€œThatâ€™d be incredibly incorrect.â€ Magistrate Yana Micallef Stafrace dismissed all charges on Monday, ruling that Jones â€œdid not recognise the accused in Courtâ€ and noting his claimed identification at the police station â€œdoes not result from the police affidavit.â€ Moreover, the court found that â€œon the day of the collision the right to silence was not administered to the accused as required by law.â€ Court therefore concluded that â€œthe evidence does not provide beyond reasonable doubt all the elements of the crime, and therefore the imputations have not been proven to the degree required in the criminal field.â€ Attard chose not to testify and was acquitted of all charges.",06/10/2025,2024-09-23 00:00:00,triq censu tabone,st pauls bay,not injured,49,M,0,Car,not injured,none,M,0,Motorbike,,,,,,,,,,,20240923,not injured,0,san pawl il bahar,triq censu tabone,night,False,False,False,False,False,True,False,False,True,False,False,0,0,1,0,0,True,False,False,2,0,0,2,False,False,False,True,True,False,False,0,0,0,1,1,0,0,False,False,False,True,35.94988,14.40962,residential,False,False,True,False,False,False,Northern,False,False,True,False,False
article_4208.0,Driver stuck in traffic says speeding LESA car shattered his mirror,"A motorist claims his car mirror was shattered by a speeding LESA vehicle that failed to stop after hitting his car while he was stuck in traffic. Frank Xerri De Caro, 78, was driving his Toyota Yaris home after a meeting on Wednesday around 5pm when the accident occurred on the Regional Road, near the St Julianâ€™s tunnels. Heavy traffic had brought vehicles to a near standstill, leaving little room for manoeuvring. As he approached the tunnels next to St Clareâ€™s Convent, Xerri De Caro said he noticed what he then believed to be a police car with sirens blaring in the distance. Attempting to give way, he moved his car closer to the side of the road. â€œI could tell the car was coming quite close to me but I couldnâ€™t move anymore as I didnâ€™t have more space to,â€ he explained. Moments later, he said a speeding LESA vehicle struck his right-hand side mirror, shattering it into pieces on the ground. Xerri De Caro described feeling both shocked and frustrated, notably when the car continued without stopping to assess the situation. â€œI was shocked at that moment but more so frustrated afterwards,â€ he said, explaining that he had to spend â‚¬300 to repair the damage. Xerri De Caro, who shared his experience on social media, initially said his mirror was destroyed by a police car.Â After filing a police report and speaking with the police on Thursday morning, he noticed he made a mistake and said that it had been a LESA car that hit his mirror.Â  He took to social media once again to praise the police for their efficient work and thanked them for their assistance.Â  LESA responded to the matter in question by saying, ""LESA has received no communication regarding this matter from the injured party prior to this media question."" They continued, "" LESA invites the injured party to provide all relevant information so that the necessary checks can be made, in accordance with the usual procedure.""",07/12/2024,2024-12-04 17:00:00,regional road,st julian's,not injured,78,M,0,Car,not injured,Unknown,Unknown,0,Car,,,,,,,,,,,20241204,not injured,0,st julian,regional road,afternoon,True,False,False,False,False,False,False,False,False,False,True,0,0,0,0,1,True,False,True,1,0,1,2,False,False,False,False,True,False,False,0,0,0,0,2,0,0,False,False,False,True,35.9034355,14.4867323,trunk,False,False,False,False,False,True,Northern,False,False,True,False,False
release_83,Woman grievously injured in traffic accident,"A 60-year-old woman residing in Swieqi, at around 1115hrs, was taken to Mater Dei Hospital because she was injured in a traffic accident in Triq E. Bradford corner with Triq il-Kappella tax-XagÄ§ra, Naxxar.Preliminary investigations showed that the woman was hit by a Volkswagen Polo driven by a 48-year-old woman who lives in Mosta.The victim was assisted by a medical team, taken to hospital by ambulance and certified to have sustained grievous injuries.Police investigations are ongoing.",11/12/2024,2024-12-11 11:15:00,triq e. bradford,naxxar,Grievious,48,F,1,Car,,,,,,,,,,,,,,,,20241211,Grievious,1,naxxar,triq ernle bradford,morning,False,False,False,False,True,False,False,False,True,False,False,0,0,1,0,0,False,True,False,0,1,0,1,False,False,False,False,True,False,False,0,0,0,0,1,0,0,False,False,False,True,35.9210351,14.4383658,residential,False,False,True,False,False,False,Northern,False,False,True,False,False
article_4024.0,â€˜Iâ€™m tired of going to friendsâ€™ funeralsâ€™: bikers' anger after skip crash death,"The president of a motorcycle advocacy group has expressed his anger at the perceived negligence of the authorities, which he says led to the death of a biker last week. Dieter Vink, 54, died last Friday, two days after crashing his motorcycle into a skip positioned on the final curve of the St Paulâ€™s Bay bypass before the Xemxija roundabout.  â€œIâ€™m sick of going to funerals. It feels like our lives are cheap,â€ Galea said, mentioning the deaths of Johanna Boni, after being hit by a truck in 2015, and Marie Claire Lombardi, who lost control of her bike after it skidded on olives spilled onto the road in 2022. Speaking about the experience of riding a motorcycle more generally, Galea said it had become more dangerous to drive on Maltaâ€™s roads over the past four or five years. â€œI think itâ€™s because drivers are frustrated by the ever-increasing traffic, which in turn leads them to drive in an impatient and careless manner. Right now, the situation feels like itâ€™s beyond repair,â€ he said. Aldo Overend, a committee member of the NGO, echoed Galeaâ€™s sentiments.Â  â€œWe just hope this accident will lead to action because we canâ€™t go on like this,"" he said. ""While riding, I feel like I constantly have to dodge heavy vehicles, construction materials, fresh concrete and water leaking from bowsers, as well as reckless car drivers not taking us into account."" Official data shows almost 40 per cent of all road traffic casualties involve motorcyclists.Â  Vinkâ€™s family and friends have vowed to get justice for his death and are seeking legal advice. A GoFundMe page has been set up to raise funds to cover funeral and legal expenses, along with a fundraising bike ride planned for December 28, starting at Mater Dei Hospital and ending at Vinkâ€™s second home, The Pitstop in Xemxija.",17/12/2024,2024-12-11 17:00:00,st pauls bay bypass,st pauls bay,Fatal,54,M,1,Motorbike,,,,,,,,,,,,,,,,20241211,Fatal,1,san pawl il bahar,xemxija bypass,afternoon,True,False,False,False,False,False,False,False,False,True,False,0,0,0,1,0,True,False,False,1,0,0,1,False,False,False,True,False,False,False,0,0,0,1,0,0,0,False,False,False,True,35.9469478,14.3994613,trunk,False,False,False,False,False,True,Northern,False,False,True,False,False
release_91,Young woman seriously injured in traffic accident,"A 17-year-old girl, residing in Qormi, yesterday, at around 1730hrs, was taken to Mater Dei Hospital because she was injured in a traffic accident in Triq il-Marfa, Mellieha.Preliminary investigations showed that the girl was hit by a Jeep Grand Cherokee driven by a 52-year-old man who lives in Zejtun. Consequently, the Jeep also hit a Honda Civic which was parked.The victim was assisted by a medical team, taken to hospital by ambulance and certified to be seriously injured.Magistrate Dr Ian Farrugia LL.D was informed of the case and appointed an inquiry.Police investigations are ongoing.",14/12/2024,2024-12-13 17:30:00,triq il-marfa,mellieha,Serious,52,M,1,Car,,,,,,,,,,,,,,,,20241213,Serious,1,mellieha,triq il-marfa,afternoon,True,False,False,False,False,False,False,False,False,True,False,0,0,0,1,0,True,False,False,1,0,0,1,False,False,False,False,True,False,False,0,0,0,0,1,0,0,False,True,True,False,35.9670439,14.3518793,trunk,False,False,False,False,False,True,Northern,False,False,True,False,False
release_22,Traffic accident in Gudja,"Yesterday, at around (1945hrs), the police were informed of a traffic accident in Dawret il-Gudja, Gudja.Preliminary investigations showed that a collision occurred between a Skoda Fabia driven by a 50-year-old man from Gudja and a Ford Fiesta, who at the time was on the side of the road with a puncture.At the time of the impact, a 29-year-old man from Birzebbugia was injured after he was trapped between the two vehicles.The victim was assisted by a medical team, taken to Mater Dei Hospital by ambulance and certified with serious injuries.Magistrate Dr Ian Farrugia LL. D was informed of the case and appointed an inquiry.Civil Protection Department personnel were also on site to assist.Police investigations are still ongoing.",14/12/2024,2024-12-13 19:45:00,dawret il-gudja,gudja,not injured,50,M,0,Car,Serious,unknown,unknown,1,Car,,,,,,,,,,,20241213,Serious,1,gudja,dawret il-gudja,evening,False,False,True,False,False,False,False,False,False,True,False,0,0,0,1,0,True,False,True,1,0,1,2,False,False,False,False,True,False,False,0,0,0,0,2,0,0,False,True,True,False,35.8522112,14.4985812,primary,False,True,False,False,False,False,South Eastern,False,False,False,True,False
article_4049.0,Motorcyclist seriously injured in Xewkija crash,"A motorcyclist was seriously injured on Sunday night in a crash on Triq l-ImÄ¡arr, Xewkija. The police said in a statement the accident was reported at 8.30pm and involved a Toyota Tercel driven by an 86-year-old woman from Xewkija and a Benelli bike driven by a 45-year-old from Sannat. The motorcyclist was rushed to the Gozo General Hospital where he was certified to have suffered serious injuries. Police investigations and a magisterial inquiry are ongoing.",16/12/2024,2024-12-15 20:30:00,triq l-imgarr,xewkija,not injured,86,F,0,Car,Serious,45,M,1,Motorbike,,,,,,,,,,,20241215,Serious,1,xewkija,triq l-imgarr,evening,False,False,True,False,False,False,False,False,True,False,True,0,0,1,0,1,True,True,False,1,1,0,2,False,False,False,True,True,False,False,0,0,0,1,1,0,0,True,False,False,False,36.02573,14.29241,secondary,False,False,False,True,False,False,Gozo,False,True,False,False,False
article_4014.0,"Two passenger vans crash, one overturns in SiÄ¡Ä¡iewi collision","Updated 6 pmÂ  Two passenger vans crashed in the limit of SiÄ¡Ä¡iewi on Tuesday afternoon, causing one of them to overturn.Â  The incident was initially reported by Transport Malta, who in a statement said that the incident involved a minivan carrying school children and that no injuries were reported.Â  However, when contacted the police said that since the incident was reported at 2.15 pm four people had been taken to Mater Dei Hospital.Â  Later on Tuesday police were able to confirm that the collision had occurred between a Mercedes Sprinter and a Renault Master on Triq Mons Mikiel Azzopardi.Â  The Mercedes Sprinter, a school van, was being driven by a 52-year-old man from GÄ§argÄ§ur, remained upright and neither the driver nor the passengers were injured.Â  The Renault Master was being driven by a 46-year-old man from San Ä wann and overturned as a result of the crash.Â  Four passengers in the van, three women aged 44, 48 and 63 from SiÄ¡Ä¡iewi and a 43-year-old woman from Rabat were injured and taken to Mater Dei Hospital.Â  Their condition had not been established at time of writing.Â  The road has since been reopened to traffic.",17/12/2024,2024-12-17 14:15:00,triq mons mikiel azzopardi,siggiewi,not injured,52,M,0,Van,Slight,46,M,4,Van,,,,,,,,,,,20241217,Slight,4,siggiewi,triq mons mikiel azzopardi,afternoon,True,False,False,False,False,False,False,False,True,True,False,0,0,1,1,0,True,False,False,2,0,0,2,False,False,False,False,False,True,False,0,0,0,0,0,2,0,False,False,False,True,35.83296,14.44018,residential,False,False,True,False,False,False,Central,True,False,False,False,False
article_3989.0,Crash between bus and car on busy Blata l-Bajda road causes traffic tailback,"Updated 6.50pm A crash between a private vehicle and a public bus on Triq Dicembru Tlettax in Blata l-Bajda caused a traffic tailback on the busy street at peak hours. Motorists toldÂ Times of MaltaÂ the crash happened on the Marsa-bound lane, not far from Our Lady of the Miraculous Medal church. The police said no one was injured in the crash. Malta Public Transport said in a statement that according to CCTV footage, the bus was stationary at the bus stop for some time before the collision. ""No injuries were reported. The company thanks the authorities for their immediate assistance.""",19/12/2024,2024-12-19 00:00:00,triq dicembru tlettax,blata l-bajda,not injured,Unknown,Unknown,0,Car,not injured,Unknown,Unknown,0,Bus,,,,,,,,,,,20241219,not injured,0,blata l-bajda,triq dicembru tlettax,night,False,False,False,False,False,True,False,False,False,False,False,0,0,0,0,0,False,False,True,0,0,2,2,False,False,False,False,True,False,True,0,0,0,0,1,0,1,False,False,False,True,35.8786271,14.4913829,trunk,False,False,False,False,False,True,Central,True,False,False,False,False
release_63,Woman grievously injured in traffic accident,"A 44-year-old woman who lives in Balzan, at around 0815hrs, was taken to Mater Dei Hospital because she was injured in a traffic accident in Triq il-Kannizzata, Balzan.Preliminary investigations showed that the victim was hit by a Mazda Demio, which was being driven by a 23-year-old woman residing in Attard.The woman was assisted by a medical team, taken to hospital by ambulance and certified to have sustained grievous injuries.Police investigations are ongoing.",19/12/2024,2024-12-19 08:15:00,triq il-kannizzata,balzan,Grievious,23,F,1,Car,,,,,,,,,,,,,,,,20241219,Grievious,1,balzan,triq il-kannizzata,morning,False,False,False,False,True,False,False,True,False,False,False,0,1,0,0,0,False,True,False,0,1,0,1,False,False,False,False,True,False,False,0,0,0,0,1,0,0,False,False,False,True,35.8963504,14.4561623,residential,False,False,True,False,False,False,Central,True,False,False,False,False
release_108,Naxxar traffic accident,"Today, at around 1045hrs, the Police were informed of a traffic accident in Triq il-Ä ermanja, Naxxar.The Police went immediately on site and preliminary investigations showed that a 78-year-old woman who resides in Naxxar, lost control of the Toyota Vitz she was driving and crashed into a parked truck.The victim was assisted by a medical team, taken to Mater Dei Hospital by ambulance and certified to be seriously injured.Magistrate Dr Joe Mifsud LL.D was informed of the case and appointed an inquiry.Civil Protection Department personnel were also on site to assist.The Police are carrying out investigations on the case.",19/12/2024,2024-12-19 10:45:00,triq il-germanja,naxxar,Serious,78,F,1,Car,,,,,,,,,,,,,,,,20241219,Serious,1,naxxar,triq il-germanja,morning,False,False,False,False,True,False,False,False,False,False,True,0,0,0,0,1,False,True,False,0,1,0,1,False,False,False,False,True,False,False,0,0,0,0,1,0,0,False,False,False,True,35.9089538,14.440024,residential,False,False,True,False,False,False,Northern,False,False,True,False,False
article_3991.0,Woman seriously injured in Naxxar traffic accident,"A 30-year-old woman from Birkirkara was taken to hospital with serious injuries after appearing to have lost control of the motorcycle she was riding. The accident occurred on Tul il-Kosta in Naxxar. The woman was treated at the scene before being taken to hospital, where her injuries were certified as serious. Police investigations are ongoing.",20/12/2024,2024-12-20 00:00:00,tul il-kosta,naxxar,Serious,30,F,1,Motorbike,,,,,,,,,,,,,,,,20241220,Serious,1,naxxar,coast road,night,False,False,False,False,False,True,False,False,True,False,False,0,0,1,0,0,False,True,False,0,1,0,1,False,False,False,True,False,False,False,0,0,0,1,0,0,0,False,False,False,True,35.9462438,14.4481762,trunk,False,False,False,False,False,True,Northern,False,False,True,False,False
article_3976.0,Child and elderly woman seriously injured in separate traffic accidents,"A child and an elderly woman were left with serious injuries on Friday after being hit by a car in separate traffic accidents. The first incident occurred at around 11:30am on Triq in-Naxxar, Birkirkara, when a 72-year-old woman from Mosta was hit by a Peugeot 307 driven by a 43-year-old man from Marsaskala. Around 15 minutes later, a two-year-old child was hit by a Suzuki SX4 driven by a 44-year-old man from Mtarfa on Triq San Ä wann Bosco in Sliema. Both victims were treated at the scene before being taken to Mater Dei Hospital, where their injuries were certified as serious. Police investigations are ongoing.",20/12/2024,2024-12-20 11:30:00,triq in-naxxar,birkirkara,Serious,72,F,1,Pedestrian,not injured,43,M,0,Car,,,,,,,,,,,20241220,Serious,1,birkirkara,triq in-naxxar,morning,False,False,False,False,True,False,False,False,True,False,True,0,0,1,0,1,True,True,False,1,1,0,2,False,True,False,False,True,False,False,0,1,0,0,1,0,0,False,False,False,True,35.8980141,14.4596416,primary,False,True,False,False,False,False,Central,True,False,False,False,False
article_3976.5,Child and elderly woman seriously injured in separate traffic accidents,"A child and an elderly woman were left with serious injuries on Friday after being hit by a car in separate traffic accidents. The first incident occurred at around 11:30am on Triq in-Naxxar, Birkirkara, when a 72-year-old woman from Mosta was hit by a Peugeot 307 driven by a 43-year-old man from Marsaskala. Around 15 minutes later, a two-year-old child was hit by a Suzuki SX4 driven by a 44-year-old man from Mtarfa on Triq San Ä wann Bosco in Sliema. Both victims were treated at the scene before being taken to Mater Dei Hospital, where their injuries were certified as serious. Police investigations are ongoing.",20/12/2024,2024-12-20 11:45:00,triq san gwann,sliema,Serious,2,Unknown,1,Pedestrian,not injured,44,M,0,Car,,,,,,,,,,,20241220,Serious,1,sliema,triq san gwann,morning,False,False,False,False,True,False,True,False,True,False,False,1,0,1,0,0,True,False,True,1,0,1,2,False,True,False,False,True,False,False,0,1,0,0,1,0,0,False,False,False,True,35.9107529,14.5000793,residential,False,False,True,False,False,False,Northern,False,False,True,False,False
release_68,Naxxar traffic accident,"Today, at around 0930hrs, the Police were informed of a traffic accident in Salini Street, Naxxar.Preliminary investigations by the Police showed that the accident occurred between three motorcycles â€“ an Aprilia that was being driven by a 31-year-old man from Qormi, a Honda that was being driven by a 40-year-old man from Mqabba and a Yamaha that was being driven by a 29-year-old man from St Paulâ€™s Bay â€“ as well as a Mercedes that was being driven by a 27-year-old woman.The men, aged 31 and 40, were assisted by a medical team and taken to Mater Dei Hospital by an ambulance. The 40-year-old man was later certified to have sustained serious injuries while the other suffered slight injuries.Magistrate Dr Joe Mifsud LL.D was informed about the case and appointed an inquiry while the Police are investigating the case.",22/12/2024,2024-12-22 09:30:00,salini street,naxxar,Serious,31,M,1,Motorbike,Slight,40,M,1,Motorbike,not injured,29,M,0.0,Motorbike,not injured,27.0,F,0.0,Car,20241222,Serious,2,naxxar,triq is-salina,morning,False,False,False,False,True,False,False,False,True,False,False,0,0,4,0,0,True,True,False,3,1,0,4,False,False,False,True,True,False,False,0,0,0,3,1,0,0,True,False,False,False,35.9369975,14.4339269,secondary,False,False,False,True,False,False,Northern,False,False,True,False,False
article_3704.0,Driver killed in Attard road crash had hit teen cyclist in December,"Alejandro Brincat, Maltaâ€™s first crash victim of the year, was driving a car that hit a teen cyclist 15 days before his fatal accident, sources confirmed with Times of Malta on Wednesday. Brincat, a father of two and football player with Vittoriosa Stars, died after he lost control of the Mercedes he was driving and ended up wedged vertically against a signpost at 9pm on Monday.Â  The 25-year-oldâ€™s death triggered an outpouring of grief from friends and family, with many paying tributes to the talented footballer and beloved father. Police and government sources confirmed with Times of Malta that Brincat was involved in an accident in Mtarfa just weeks before, leaving a 13-year-old girl grievously injured after being hit by a car while cycling in Mtarfa.Â  The incident happened on December 22 along Triq Sir Philip Pullicino, when a car, a Ford B Max, driven by a 25-year-old hit the young girl. She was given first-aid on-site before being rushed to hospital.Â  Sources said that after the accident, Brincatâ€™s car was impounded by the police.Â  The Mercedes involved in the fatal accident on Monday was not his.Â  Times of Malta understands that residents of Mtarfa, where Brincat was from, had previously complained about the young man's driving habits.Â  Dashcam video of the fatal crash seen by Times of Malta shows an over-speeding car swerving out of control, hitting a crash barrier and then rising up, flying into a signpost.Â  Magistrate Ian Farrugia has opened an inquiry into the crash but magisterial inquiries are secret so the results are unlikely to ever be published.Â  A Transport Safety Investigative Commission due to have been set up in 2023 has been beset by delays.",08/01/2025,2024-12-22 10:15:00,triq sir philip pullicino,mtarfa,Grievious,13,F,1,Bicycle,not injured,25,M,1,car,,,,,,,,,,,20241222,Grievious,2,mtarfa,triq sir philip pullicino,morning,False,False,False,False,True,False,True,False,True,False,False,1,0,1,0,0,True,True,False,1,1,0,2,False,False,True,False,True,False,False,0,0,1,0,1,0,0,True,False,False,False,35.8903766,14.3931157,residential,False,False,True,False,False,False,Central,True,False,False,False,False
article_3910.0,Bus driver dies day after Regional Road crash,"A 37-year-old bus driver has died after succumbing to his injuries following a traffic collision on Monday. The man was named 37-year-old Hussein Shah by his employer, bus company Tallinja.Â  Shah was critically hurt in a collision with a van that forced the temporary closure of Regional Road on Monday.Â  In a statement on Tuesday, police said that Shah had died at Mater Dei Hospital.Â   Tallinja said that Shah was a Pakistani national and a father of four children, adding that they are deeply saddened by his loss.Â  He joined the company earlier this year, having previously worked as a bus driver and school bus driver in the United Arab Emirates.Â  ""Our thoughts and prayers go out to his family and friends in these difficult times,"" they said.Â  The incident happened yesterday at 10.30am on the southbound lane of Regional Road.Â  The bus, which was not carrying passengers, ended up straddling the centre strip and debris was spread over a wide area, causing the closure of busy traffic lanes. The van was driven by a 39-year-old woman from Naxxar who was not seriously hurt.",24/12/2024,2024-12-23 10:30:00,regional road,msida,Fatal,37,M,1,bus,Slight,39,F,1,van,,,,,,,,,,,20241223,Fatal,2,msida,regional road,morning,False,False,False,False,True,False,False,False,True,False,False,0,0,2,0,0,True,True,False,1,1,0,2,False,False,False,False,False,True,True,0,0,0,0,0,1,1,False,False,True,False,35.9034355,14.4867323,trunk,False,False,False,False,False,True,Central,True,False,False,False,False
release_59,Traffic accident in St Julian&#8217;s,"Yesterday, at around 1530hrs, the Police were informed about a traffic accident in Mikiel Anton Vassalli Street, St Julianâ€™s.Preliminary investigations showed that a 28-year-old man from Å»ejtun lost control of the BMW he was driving and overturned. A 25-year-old man from Zejtun was also in the vehicle.The 25-year-old was assisted by a medical team, taken to Mater Dei Hospital by an ambulance and certified to have sustained grievous injuries.Members of the Civil Protection Department were also on site to assist.The Police are investigating the case.",26/12/2024,2024-12-25 15:30:00,mikiel anton vassalli street,st julians,Grievious,28,M,1,Car,,,,,,,,,,,,,,,,20241225,Grievious,1,st julian,triq mikiel anton vassalli,afternoon,True,False,False,False,False,False,False,False,True,False,False,0,0,1,0,0,True,False,False,1,0,0,1,False,False,False,False,True,False,False,0,0,0,0,1,0,0,False,True,True,False,35.8981962,14.4867393,trunk,False,False,False,False,False,True,Northern,False,False,True,False,False
release_25,Marsa traffic accident,"Today, at about 0745hrs, the Police were informed of a traffic accident in Triq DiÄ‹embru Tlettax, Marsa.The Police went immediately on site and preliminary investigations showed that a 36-year-old Turkish national, resident in Zabbar, lost control of the Toyota Vitz he was driving and crashed into the barriers and a pole.The victim was assisted by a medical team, taken to Mater Dei Hospital by ambulance and certified to have sustained grievous injuries.Civil Protection Department personnel were also on site to assist.Police investigations are still ongoing.",27/12/2024,2024-12-27 07:45:00,triq dicembru tlettax,marsa,Grievious,36,M,1,Car,,,,,,,,,,,,,,,,20241227,Grievious,1,marsa,triq dicembru tlettax,early_morning,False,True,False,False,False,False,False,False,True,False,False,0,0,1,0,0,True,False,False,1,0,0,1,False,False,False,False,True,False,False,0,0,0,0,1,0,0,False,False,True,False,35.8786271,14.4913829,trunk,False,False,False,False,False,True,Southern Harbour,False,False,False,False,True
article_3900.0,Woman seriously injured in traffic accident in Å»ejtun,"A 62-year-old woman from Ä¦amrun was taken to hospital with serious injuries Friday after being involved in a traffic accident in Å»ejtun shortly before midday.Â  The accident occurred on Triq il-Ä¦otba.Â  Initial investigations suggest the Honda motorcycle ridden by the woman was involved in a collision with an Isuzu truck driven by a 25-year-old Ä¦al Luqa resident. The woman was treated at the scene before being taken to Mater Dei Hospital, where her injuries were certified as serious. Police investigations are ongoing.",27/12/2024,2024-12-27 11:30:00,triq il-hotba,zejtun,Serious,62,F,1,Motorbike,not injured,25,M,0,Van,,,,,,,,,,,20241227,Serious,1,zejtun,triq il-hotba,morning,False,False,False,False,True,False,False,False,True,True,False,0,0,1,1,0,True,True,False,1,1,0,2,False,False,False,True,False,True,False,0,0,0,1,0,1,0,False,False,True,False,35.85592,14.53341,residential,False,False,True,False,False,False,South Eastern,False,False,False,True,False
release_56,Motorcycle-truck collision in Å»ejtun,"Today, at around noon, the Police were informed of a traffic accident in Triq il-Ä¦otba, Å»ejtun.Preliminary investigations showed that a collision occurred between a Honda motorcycle driven by a 62-year-old woman residing in Ä¦amrun and an Isuzu truck driven by a 25-year-old Indian man residing in Luqa.The woman was assisted by a medical team and taken to Mater Dei Hospital by ambulance, where she was certified to have sustained grievous injuries.Police investigations are still ongoing.",27/12/2024,2024-12-27 12:00:00,triq il-hotba,zejtun,Grievious,62,F,1,Motorbike,not injured,25,M,0,Van,,,,,,,,,,,20241227,Grievious,1,zejtun,triq il-hotba,morning,False,False,False,False,True,False,False,False,True,True,False,0,0,1,1,0,True,True,False,1,1,0,2,False,False,False,True,False,True,False,0,0,0,1,0,1,0,False,False,True,False,35.85592,14.53341,residential,False,False,True,False,False,False,South Eastern,False,False,False,True,False
release_10,Number of persons hospitalised following Å»abbar accident,"Today, at around quarter past nine in the morning (0915 hrs), assistance was requested in St James Square, Zabbar after a vehicle hit a number of people.The Police went immediately on site together with a number of ambulances and members of the Civil Protection Department.It resulted from initial investigations that a 79-year-old man, from Zabbar, lost control of the vehicle he was driving and accidentally hit some persons. He was taken to Mater Dei Hospital for observation, but it was later confirmed that he was not injured.Four women, aged 39, 66, 77 and 84, and two men aged 36 and 81, all residing in Zabbar, were taken to Mater Dei Hospital by ambulances. The 84-year-old woman was later certified as suffering from grievous injuries and the others were certified as suffering from slight injuries. Three other persons were treated at the scene of the accident.Police investigations in connection with this incident are ongoing.",28/12/2024,2024-12-28 09:15:00,st james square,zabbar,Grievious,79,M,9,unknown,,,,,,,,,,,,,,,,20241228,Grievious,9,zabbar,st james square,morning,False,False,False,False,True,False,False,False,False,False,True,0,0,0,0,1,True,False,False,1,0,0,1,True,False,False,False,False,False,False,1,0,0,0,0,0,0,True,False,True,False,35.87334,14.53592,residential,False,False,True,False,False,False,Southern Harbour,False,False,False,False,True
article_3766.0,Three in hospital following Birkirkara bypass crash,"Updated 12.30pm Three people were taken to hospital on Sunday morning following a two-car collision on the Birkirkara bypass. Two of those involved were grievously injured, the police said.Â  The collision was reported at around 7am and involved a Honda Fit and Suzuki Swift.  A 72-year-old man driving the Honda and his 66-year-old female passenger, both from Iklin, had to be extracted from the vehicle with the help of Civil Protection Department officials. Both were taken to Mater Dei Hospital with grievous injuries.Â  A 28-year-old male from Å»ebbuÄ¡ who was driving the Suzuki was also taken to hospital but only suffered minor injuries in the crash. No details about their medical conditions were available at the time of writing.",05/01/2025,2025-01-05 07:00:00,birkirkara bypass,birkirkara,Grievious,72,M,2,Car,Slight,28,M,1,Car,,,,,,,,,,,20250105,Grievious,3,birkirkara,triq dun karm,early_morning,False,True,False,False,False,False,False,False,True,False,True,0,0,1,0,1,True,False,False,2,0,0,2,False,False,False,False,True,False,False,0,0,0,0,2,0,0,True,False,True,False,35.9003979,14.4751653,trunk,False,False,False,False,False,True,Central,True,False,False,False,False
release_84,Fgura traffic accident,"Update:Unfortunately, the 24-year-old woman recently lost her life at Mater Dei Hospital.The Magisterial Inquiry and Police investigations are ongoing.Earlier:Yesterday, at around 2000hrs, two women, aged 34 and 24 from Nepal, were taken to Mater Dei Hospital after being injured in a traffic accident in Triq Hompesh, Fgura.It resulted from initial investigations that the two women were hit by a Toyota Hilux that was being driven by a 20-year-old woman from BirÅ¼ebbuÄ¡a.The victims were assisted by a medical team and taken to hospital by an ambulance where the 24-year-old woman was later certified to have sustained grievous injuries while the other woman was certified to have sustained grievous injuries.Magistrate Ian Farrugia LL.D was informed about the case who opened an inquiry while Police investigations are still ongoing.",07/01/2025,2025-01-06 20:00:00,triq hompesh,fgura,Fatal,20,F,1,Van,Serious,20,F,1,Van,,,,,,,,,,,20250106,Fatal,2,fgura,triq hompesch,evening,False,False,True,False,False,False,False,True,False,False,False,0,2,0,0,0,False,True,False,0,2,0,2,False,False,False,False,False,True,False,0,0,0,0,0,2,0,False,False,True,False,35.8723089,14.5218635,primary,False,True,False,False,False,False,South Eastern,False,False,False,True,False
article_3699.0,"Today's front pages â€“ January 8, 2025","The following are the top stories in Malta's newspapers on Wednesday. All newspapers lead with news that Alejandro Brincat, 25, died when the car he was driving jumped a crash barrier in Attard and smashed into a tree and a signpost late on Monday. Times of MaltaÂ also reports on its front page that environmental activists and the Opposition expressed their shock at former Planning Authority CEO Johann Buttigiegâ€™s reappointment. The Malta IndependentÂ meanwhile reports that Buttigieg officially found out about his appointment as PA CEO through the media.Â  MaltaTodayÂ leads with data showing that applications for planning permits increased by 12% for 2024. In-NazzjonÂ publishes comments by PN leader Bernard Grech who insisted that the Attorney General should publish the 17 Black inquiry.Â  L-orizzontÂ focuses on the government's presentation of the island's plan for energy and climate to the European Commission.",08/01/2025,2025-01-06 21:00:00,mdina road,attard,Fatal,25,M,1,car,,,,,,,,,,,,,,,,20250106,Fatal,1,attard,triq l-imdina,evening,False,False,True,False,False,False,False,False,True,False,False,0,0,1,0,0,True,False,False,1,0,0,1,False,False,False,False,True,False,False,0,0,0,0,1,0,0,False,False,True,False,35.874767,14.4608589,trunk,False,False,False,False,False,True,Central,True,False,False,False,False
release_27,Attard fatal accident,"A 25-year-old man, a resident of Mtarfa, lost his life late last night in a traffic accident in Attard.The accident occurred at around 2120hrs in Triq L-Imdina.Preliminary investigations showed that the victim was driving a Mercedes, lost control and as a result the car crashed into a tree. Police, medical teams from Mater Dei and members of the Civil Protection Department were immediately called on site. Unfortunately, the man was certified dead on the spot.Magistrate Dr Ian Farrugia LL.D appointed an inquiry assisted by various experts, while Police investigations in connection with this incident are still ongoing.",07/01/2025,2025-01-06 21:20:00,triq l-imdina,attard,Fatal,25,M,1,Car,,,,,,,,,,,,,,,,20250106,Fatal,1,attard,triq l-imdina,late_evening,False,False,False,True,False,False,False,False,True,False,False,0,0,1,0,0,True,False,False,1,0,0,1,False,False,False,False,True,False,False,0,0,0,0,1,0,0,False,False,True,False,35.874767,14.4608589,trunk,False,False,False,False,False,True,Central,True,False,False,False,False
article_3671.0,Elderly passenger injured in Rabat crash,"An 83-year-old woman was injured on Thursday after the car she was in crashed into a wall in Rabat.Â  The incident happened at around 11am in Triq GÄ§eriexem, where police found that a Suzuki Alto being driven by a 56-year-old woman from San Ä wann had been involved in a crash. The 83-year-old, also from San Ä wann, was in the passenger seat of the car.Â  The 56-year-old lost control of the car and crashes into a light post and a wall.Â Â  The two women were treated on site by a medical team and members of the civil protection department before being taken to Mater Dei Hospital by ambulance.Â  Later the 83-year-old was certified as having grievous injuries while the 56-year-old was only lightly injured.Â  A police investigation into the matter is ongoing.",09/01/2025,2025-01-09 11:00:00,triq gheriexem,rabat,Grievious,56,F,2,Car,,,,,,,,,,,,,,,,20250109,Grievious,2,rabat,triq gheriexem,morning,False,False,False,False,True,False,False,False,False,True,False,0,0,0,1,0,False,True,False,0,1,0,1,False,False,False,False,True,False,False,0,0,0,0,1,0,0,False,False,False,True,35.8847418,14.3972858,secondary,False,False,False,True,False,False,Central,True,False,False,False,False
article_3601.0,Two motorcyclists injured in separate accidents,"Two motorcyclists were injured in separate accidents on Wednesday morning, police said.Â  The first happened at 7.45am in Anton Cassar Street, Marsa, when a motorcycle and a car collided. The victim was a 21-year-old man from Fgura, who was hospitalised. The car was driven by a 21-year-old woman from Qormi, who was unhurt. In the second accident at Tal-Barrani Road a 30-year-old Italian man fell off his motorcycle at about 8am. Both motorcyclists were treated for their injuries in hospital.",15/01/2025,2025-01-15 07:45:00,anton cassar street,marsa,Serious,21,M,1,Motorbike,,,,,,,,,,,,,,,,20250115,Serious,1,marsa,triq anton cassar,early_morning,False,True,False,False,False,False,False,True,False,False,False,0,1,0,0,0,True,False,False,1,0,0,1,False,False,False,True,False,False,False,0,0,0,1,0,0,0,False,False,False,True,35.8801056,14.4930563,residential,False,False,True,False,False,False,Southern Harbour,False,False,False,False,True
release_800,Persons injured in separate traffic accidents,"Two men were taken to Mater Dei Hospital after being injured in two separate traffic accidents earlier today.The first accident occurred at around 0745hrs, in Triq Anton Cassar, Marsa. Preliminary investigations showed that a collision occurred between a Suzuki motorcycle driven by a 21-year-old man residing in Fgura and a Toyota Vitz driven by a 21-year-old woman residing in Qormi.The second incident happened at around 0800hrs, in Triq Tal-Barrani, Å»ejtun. Preliminary investigations showed that a 30-year-old Italian man, who lives in GÄ§axaq, was riding a Yamaha motorcycle, lost control and fell.A medical team assisted in both accidents and the two motorcyclists were taken to hospital by ambulance for medical treatment, where they were certified to have sustained grievous injuries.Police investigations are ongoing.",15/01/2025,2025-01-15 07:45:00,triq tal-barrani,zejtun,Grievious,30,M,1,Motorbike,,,,,,,,,,,,,,,,20250115,Grievious,1,zejtun,triq tal-barrani,early_morning,False,True,False,False,False,False,False,False,True,False,False,0,0,1,0,0,True,False,False,1,0,0,1,False,False,False,True,False,False,False,0,0,0,1,0,0,0,False,False,False,True,35.85431,14.52877,secondary,False,False,False,True,False,False,South Eastern,False,False,False,True,False
article_3586.0,"Pedestrian, 63, run over by car in Sliema","A 63-year-old pedestrian was injured in Sliema when he was hit by a car at around 4.45pm on Wednesday. The police said the accident was reported at 4.45pm onÂ Triq Ä uÅ¼e' HowardÂ corner with Triq GÄ§ar Id-Dud. Both roads have been closed to traffic.Â  The person behind the wheel of the Toyota Aygo that hit the man has been identified as a 36-year-old Indian national from San Ä wann. The pedestrian, from Sliema, was rushed to Mater Dei Hospital. His condition remains unknown. Police investigations are ongoing.",15/01/2025,2025-01-15 16:45:00,triq guze' howard corner with triq ghar id-dud,sliema,not injured,36,M,0,Car,Serious,63,M,1,Pedestrian,,,,,,,,,,,20250115,Serious,1,sliema,triq guze howard,afternoon,True,False,False,False,False,False,False,False,True,True,False,0,0,1,1,0,True,False,False,2,0,0,2,False,True,False,False,True,False,False,0,1,0,0,1,0,0,False,False,False,True,35.91672,14.50203,residential,False,False,True,False,False,False,Northern,False,False,True,False,False
release_88,Man grievously injured in traffic accident,"A 63-year-old man who lives in Å»urrieq, at around 1930hrs, was taken to Mater Dei Hospital because he was injured in a traffic accident in Blue Grotto Avenue, Å»urrieq.Preliminary investigations showed that the man was hit by a Citroen Saxo, which was being driven by a 19-year-old man residing in Luqa.The man was assisted by a medical team, taken to hospital by ambulance and certified to have sustained grievous injuries.Police investigations are ongoing.",15/01/2025,2025-01-15 19:30:00,blue grotto avenue,zurrieq,Grievious,19,M,1,Car,,,,,,,,,,,,,,,,20250115,Grievious,1,zurrieq,blue grotto avenue,evening,False,False,True,False,False,False,False,True,False,False,False,0,1,0,0,0,True,False,False,1,0,0,1,False,False,False,False,True,False,False,0,0,0,0,1,0,0,False,False,False,True,35.8298773,14.4695035,secondary,False,False,False,True,False,False,South Eastern,False,False,False,True,False
article_3551.0,Motorcyclist grievously injured in Naxxar crash,"A 34-year-old motorcyclist was grievously injured in a crash at 10.15am in Naxxar on Thursday. The police said the accident, on Triq il-Fortizza tal-Mosta involved a Vauxhall driven by a 45-year-old woman from Naxxar and a Daelim motorbike driven by the man, a Mosta resident. The man was given first aid on site and rushed to Mater Dei Hospital. Police investigations are ongoing.",16/01/2025,2025-01-16 10:15:00,triq il-fortizza tal-mosta,naxxar,not injured,45,F,0,car,Serious,34,M,1,Motorbike,,,,,,,,,,,20250116,Serious,1,naxxar,triq il-fortizza tal-mosta,morning,False,False,False,False,True,False,False,False,True,False,False,0,0,2,0,0,True,True,False,1,1,0,2,False,False,False,True,True,False,False,0,0,0,1,1,0,0,False,False,False,True,35.92741,14.45192,secondary,False,False,False,True,False,False,Northern,False,False,True,False,False
article_102356.0,Watch: Alleged Bidnija killer rams car in road rage incident in January,"A man accused of the recent Bidnija murder was at the wheel of a truck that appeared to have deliberately ploughed into a vehicle in an incident last January, according to footage obtained by Times of Malta. The alleged road rage incident shows the large vehicle driving straight into the car on the road as a man is seen trying to close the back passenger door.Â Mohamed Hamdan was later identified as the driver of the truck. The incident happened on January 20 on Triq it-Turisti in St Paulâ€™s Bay. Hamdan, 46, who has a history of crime, stands accused of killing Jean Paul Busuttil following a collision between the two on a country lane in Bidnija early on June 29. He is pleading not guilty to all charges.  Surveyorsâ€™ reports seen by Times of Malta detail the extensive damage sustained by the car of the victim, who is still chasing his money. One of the reports states that the car sustained â€œvery extensive damages on the left side panels, rear and right frontâ€. The collision also caused the left side airbags to deploy. The left side panels were pushed onto the passengerâ€™s compartment. The rear extensive damage affected the tailgate, rear panel, tow bar, rear trim and rear right wing. It estimated the total repair costs at â‚¬13,759. The surveyor appointed by the insurance estimated the repair works at â‚¬15,658. Questions have been sent to the police about the case. Times of Malta understands that they are expected to take action.",14/07/2025,2025-01-20 00:00:00,triq it-turisti,st paul's bay,not injured,46,M,0,van,not injured,none,none,0,car,,,,,,,,,,,20250120,not injured,0,san pawl il bahar,triq it-turisti,night,False,False,False,False,False,True,False,False,True,False,False,0,0,1,0,0,True,False,True,1,0,1,2,False,False,False,False,True,True,False,0,0,0,0,1,1,0,False,False,False,True,35.95031,14.40688,secondary,False,False,False,True,False,False,Northern,False,False,True,False,False
release_105,Sliema traffic accident,"Yesterday, at around 1800 hrs, the Police were informed of a traffic accident in Triq Rodolfu, Sliema.Preliminary investigation showed that a collision occurred between a Dacia Duster that was being driven by a 47-year-old Filipino man from Santa Venera and a Kymco Agility motorcycle that was being driven by a 51-year-old man from Sliema.The biker was assisted by a medical team and taken to Mater Dei Hospital by an ambulance for further medical attention. He was later certified to have sustained grievous injuries.The Police are investigating the case.",23/01/2025,2025-01-22 18:00:00,triq rodolfu,sliema,not injured,47,M,0,Car,Grievious,51,M,1,Motorbike,,,,,,,,,,,20250122,Grievious,1,sliema,triq rodolfu,afternoon,True,False,False,False,False,False,False,False,True,True,False,0,0,1,1,0,True,False,False,2,0,0,2,False,False,False,True,True,False,False,0,0,0,1,1,0,0,False,False,False,True,35.9104721,14.4987943,tertiary,False,False,False,False,True,False,Northern,False,False,True,False,False
release_40,Fatal motorcycle accident,"A 36-year-old Italian man, residing in Birkirkara, lost his life late last night in a traffic accident in Msida.The accident happened at around 2015hrs in Mikiel Anton Vassalli Street.From initial investigations it appears that the man was riding a Honda motorcycle and while he was in the tunnel, he lost control, crashed into the wall and fell.The victim was immediately assisted by a medical team and taken to Mater Dei Hospital by ambulance. Unfortunately, he was certified dead shortly afterwards.Magistrate Dr Philip Galea Farrugia LL. D was informed of the case and appointed an inquiry.Police investigations are still ongoing.",24/01/2025,2025-01-23 20:15:00,mikiel anton vassalli street,msida,Fatal,36,M,1,Motorbike,,,,,,,,,,,,,,,,20250123,Fatal,1,msida,triq mikiel anton vassalli,evening,False,False,True,False,False,False,False,False,True,False,False,0,0,1,0,0,True,False,False,1,0,0,1,False,False,False,True,False,False,False,0,0,0,1,0,0,0,False,False,False,True,35.8981962,14.4867393,trunk,False,False,False,False,False,True,Central,True,False,False,False,False
article_3408.0,Motorcyclist injured in Coast Road crash,"Updated 5pm A collision between a car and a motorcycle close to Salini on Saturday afternoon forced the partial closure of the Coast Road.Â  A 46-year-old man from Fgura was driving his Suzuki motorcycle towards St Paul's Bay when he collided with a BMW heading towards St Julian's.Â  Police said the man was injured and taken to Mater Dei Hospital but is not in danger of dying. The BMW driver was not injured. Earlier on Saturday traffic towards St Julian's had been at a standstill, but resumed normal function once the road reopened at 5pm.",25/01/2025,2025-01-25 13:00:00,coast road,salini,Slight,46,M,1,Motorbike,Serious,Unknown,Unknown,0,Car,,,,,,,,,,,20250125,Serious,1,naxxar,coast road,afternoon,True,False,False,False,False,False,False,False,True,False,False,0,0,1,0,0,True,False,True,1,0,1,2,False,False,False,True,True,False,False,0,0,0,1,1,0,0,True,False,False,False,35.9462438,14.4481762,trunk,False,False,False,False,False,True,Northern,False,False,True,False,False
release_54,Man grievously injured in traffic accident,"Yesterday, at half past two in the afternoon (1430 hrs), the Police were informed of a traffic accident along the Coast Road, in Naxxar.Preliminary investigations showed that a 46-year-old man from Fgura lost control of his Suzuki motorcycle, fell and crashed into a BMW which was being driven on the opposite lane by a 30-year-old man from St Paulâ€™s Bay.The motorcyclist was assisted by a medical team and taken to Mater Dei Hospital by ambulance. He was later certified to have sustained grievous injuries.The Police are investigating the case.",26/01/2025,2025-01-25 14:30:00,coast road,naxxar,Grievious,46,M,1,Motorbike,not injured,30,M,1,Car,,,,,,,,,,,20250125,Grievious,2,naxxar,coast road,afternoon,True,False,False,False,False,False,False,False,True,False,False,0,0,2,0,0,True,False,False,2,0,0,2,False,False,False,True,True,False,False,0,0,0,1,1,0,0,True,False,False,False,35.9462438,14.4481762,trunk,False,False,False,False,False,True,Northern,False,False,True,False,False
release_47,Persons injured in separate traffic accidents,"Two men were taken to Mater Dei Hospital after being injured in two separate traffic accidents earlier today.The first accident occurred at around 0500hrs, in Hal Farrug Road, Luqa. Preliminary investigations showed that a 34-year-old man from Qrendi was driving a Ford Fiesta, lost control and crashed into an electricity pole.The second incident happened for about the 1245hrs, in Dâ€™ Argens Street, Gzira. Preliminary investigations showed that a collision occurred between a Yamaha YB125 motorcycle driven by a 59-year-old man residing in Fgura and a Mazda Demio driven by a 30-year-old man residing in Birkirkara.A medical team assisted in both incidents and the two men aged 34 and 59 years were taken to hospital by ambulance for medical treatment, where they were certified to have sustained grievous injuries.Police investigations are ongoing.",01/02/2025,2025-02-01 05:00:00,hal farrug rd,luqa,Grievious,34,M,1,Car,,,,,,,,,,,,,,,,20250201,Grievious,1,luqa,hal farrug street,night,False,False,False,False,False,True,False,False,True,False,False,0,0,1,0,0,True,False,False,1,0,0,1,False,False,False,False,True,False,False,0,0,0,0,1,0,0,True,False,False,False,35.85463,14.48697,secondary,False,False,False,True,False,False,South Eastern,False,False,False,True,False
release_470,Persons injured in separate traffic accidents,"Two men were taken to Mater Dei Hospital after being injured in two separate traffic accidents earlier today.The first accident occurred at around 0500hrs, in Hal Farrug Road, Luqa. Preliminary investigations showed that a 34-year-old man from Qrendi was driving a Ford Fiesta, lost control and crashed into an electricity pole.The second incident happened for about the 1245hrs, in Dâ€™ Argens Street, Gzira. Preliminary investigations showed that a collision occurred between a Yamaha YB125 motorcycle driven by a 59-year-old man residing in Fgura and a Mazda Demio driven by a 30-year-old man residing in Birkirkara.A medical team assisted in both incidents and the two men aged 34 and 59 years were taken to hospital by ambulance for medical treatment, where they were certified to have sustained grievous injuries.Police investigations are ongoing.",01/02/2025,2025-02-01 12:45:00,rue d'argens st,gzira,not injured,30,M,0,Car,Grievious,59,M,1,Motorbike,,,,,,,,,,,20250201,Grievious,1,gzira,rue d'argens,afternoon,True,False,False,False,False,False,False,False,True,True,False,0,0,1,1,0,True,False,False,2,0,0,2,False,False,False,True,True,False,False,0,0,0,1,1,0,0,True,False,False,False,35.9066493,14.4936073,secondary,False,False,False,True,False,False,Southern Harbour,False,False,False,False,True
release_79,Man grievously injured in a traffic accident,"Yesterday, at around 1900 hrs, the Police were informed of a traffic accident in Triq il-Palma, Paola.Preliminary investigations showed that a 68-year-old man, a resident of Paola, was hit by a Renault Clio that was being driven by a 44-year-old man, also a resident of Paola.The victim was assisted by a medical team and taken to Mater Dei Hospital by an ambulance. He was later certified to have sustained grievous injuries.The Police are investigating the case",04/02/2025,2025-02-03 19:00:00,triq il-palma,paola,Grievious,44,M,1,Car,,,,,,,,,,,,,,,,20250203,Grievious,1,paola,triq il-palma,evening,False,False,True,False,False,False,False,False,True,False,False,0,0,1,0,0,True,False,False,1,0,0,1,False,False,False,False,True,False,False,0,0,0,0,1,0,0,False,False,False,True,35.8709648,14.5040803,tertiary,False,False,False,False,True,False,Southern Harbour,False,False,False,False,True
article_3197.0,Two injured in Å»ejtun crash,"A motorcyclist and a pillion rider were seriously injured in a collision in Å»ejtun on Tuesday morning. The police said the crash occurred in Triq Alfredo Cachia Zammit at 11.30am. It involved a Skoda Fabia driven by a 58-year-old woman from Å»abbar and a Yamaha T115 driven by a 66-year-old man from Cospicua accompanied by a 56-year-old woman from Cospicua, who was riding pillion. Both were given first aid by a medical team before being hospitalised. . The police are investigating.",04/02/2025,2025-02-04 11:30:00,triq alfredo cachia zammit,zejtun,not injured,58,F,0,Car,Serious,66,M,2,Motorbike,,,,,,,,,,,20250204,Serious,2,zejtun,triq alfredo cachia zammit,morning,False,False,False,False,True,False,False,False,False,True,True,0,0,0,1,1,True,True,False,1,1,0,2,False,False,False,True,True,False,False,0,0,0,1,1,0,0,False,False,False,True,35.8565578,14.5306657,secondary,False,False,False,True,False,False,South Eastern,False,False,False,True,False
release_107,Motorcycle accident in Attard,"A 52-year-old man and residing in Ä¦aÅ¼-Å»ebbuÄ¡, at around 0900hrs, was taken to Mater Dei Hospital because he was injured in a traffic accident in Vjal L-Istadium Nazzjonali in Taâ€™ Qali, Attard.Preliminary investigations showed that the man was riding a Kymco motorcycle, lost control and fell.He was assisted by a medical team, taken to hospital by ambulance and certified to have sustained grievous injuries.Police investigations are ongoing.",05/02/2025,2025-02-05 09:00:00,vjal l-istadium nazzjonali,attard,Grievious,52,M,1,Motorbike,,,,,,,,,,,,,,,,20250205,Grievious,1,attard,vjal l-istadium nazzjonali,morning,False,False,False,False,True,False,False,False,False,True,False,0,0,0,1,0,True,False,False,1,0,0,1,False,False,False,True,False,False,False,0,0,0,1,0,0,0,False,False,False,True,35.8905211,14.4223,secondary,False,False,False,True,False,False,Central,True,False,False,False,False
article_3169.0,Motorcyclist injured in traffic accident on Naxxar's Labour Avenue,"A motorcyclist was rushed to Mater Dei Hospital on Thursday morning following a traffic accident on Labour Avenue in Naxxar. The police toldÂ Times of MaltaÂ the 35-year-old man, from Mosta, was driving a Yamaha XP560 on Labour Avenue at around 8am.Â  He was involved in a crash with a Toyota Vitz driven by a 26-year-old woman from Å»abbar. The motorcyclist was rushed to Mater Dei. While hisÂ condition remains unknown, he did not suffer life-threatening injuries. Police investigations are ongoing.",06/02/2025,2025-02-06 08:00:00,labour avenue,naxxar,Slight,35,M,1,Motorbike,not injured,26,F,0,Car,,,,,,,,,,,20250206,Slight,1,naxxar,triq il-labour,early_morning,False,True,False,False,False,False,False,False,True,False,False,0,0,2,0,0,True,True,False,1,1,0,2,False,False,False,True,True,False,False,0,0,0,1,1,0,0,False,False,False,True,35.91438,14.44251,residential,False,False,True,False,False,False,Northern,False,False,True,False,False
release_100,Traffic accident in Gozo,"Yesterday, at around 2100hrs, the Police were informed of a traffic accident in Triq ir-Rabat, Å»ebbuÄ¡, Gozo.The Police immediately went to the scene and from a preliminary investigation it was revealed that a 25-year-old Macedonian resident of Å»ebbuÄ¡, Gozo, lost control of the Isuzu WFR van he was driving and fell into a valley about one and a half stories high. In the van, there was a 36-year-old compatriot also resident of Å»ebbuÄ¡, Gozo.Members of the Civil Protection and a medical team were called to the scene to assist. An ambulance took the men to the Gozo General Hospital to receive the necessary treatment, where they were certified with grievous injuries.Police investigations are still ongoing.",09/02/2025,2025-02-08 21:00:00,triq ir-rabat,zebbug,Grievious,25,M,2,Van,,,,,,,,,,,,,,,,20250208,Grievious,2,zebbug,triq ir-rabat,evening,False,False,True,False,False,False,False,False,True,False,False,0,0,1,0,0,True,False,False,1,0,0,1,False,False,False,False,False,True,False,0,0,0,0,0,1,0,True,False,False,False,36.0672705,14.259524,secondary,False,False,False,True,False,False,Central,True,False,False,False,False
release_102,Two policemen injured in Tarxien accident,"Two police officers were grievously injured last night when they were involved in an accident while following a vehicle which left the scene at excessive speed after the driver noticed the presence of the police.At around 0130hrs, the Police were asked to assist on an argument in Å»urrieq. Upon arriving in the vicinity, they noticed a person who was involved in the case fleeing the scene with a BMW.The police therefore followed this vehicle and as soon as they arrived in Triq is-Sorijiet, Tarxien, the Corps vehicle, Hyundai Tucson, was involved in a collision with a Fiat 500, driven by a 25-year-old woman residing in Tarxien. The two policemen were taken to Mater Dei Hospital for treatment and were certified to be suffering from grievous injuries, while the woman suffered slight injuries.Six parked vehicles were hit as a result of the impact.A number of persons are being spoken to by the Police about the case.Police investigations into this case are ongoing.",09/02/2025,2025-02-09 01:30:00,triq is-sorijiet,tarxien,Grievious,unknown,unknown,2,Car,Slight,25,F,1,Car,,,,,,,,,,,20250209,Grievious,3,tarxien,triq is-sorijiet,night,False,False,False,False,False,True,False,False,True,False,False,0,0,1,0,0,False,True,True,0,1,1,2,False,False,False,False,True,False,False,0,0,0,0,2,0,0,True,False,False,False,35.8702636,14.5103851,residential,False,False,True,False,False,False,Southern Harbour,False,False,False,False,True
release_43,Woman grievously injured in traffic accident,"A 75-year-old woman who lives in Marsascala, at around 0945hrs, was taken to Mater Dei Hospital because she was injured in a traffic accident in Triq Santâ€™Antnin, Marsascala.Preliminary investigations showed that the victim was hit by a Mazda Demio, which was being driven by a 54-year-old woman residing in Marsascala aswell.The woman was assisted by a medical team, taken to hospital by ambulance and certified to have sustained grievous injuries.Police investigations are ongoing.",09/02/2025,2025-02-09 09:45:00,triq santantnin,marsascala,Grievious,54,F,1,Car,,,,,,,,,,,,,,,,20250209,Grievious,1,marsascala,triq sant antnin,morning,False,False,False,False,True,False,False,False,False,True,False,0,0,0,1,0,False,True,False,0,1,0,1,False,False,False,False,True,False,False,0,0,0,0,1,0,0,True,False,False,False,35.862551,14.5587173,secondary,False,False,False,True,False,False,South Eastern,False,False,False,True,False
article_3090.0,Fatal Kirkop tunnels crash happened 'during illegal car race',"A motorist who died late on Monday was taking part in an illegal car race, sources confirmed on Tuesday. Christ Gatt, 24, of Mtarfa, died on the spot after his BMW crashed into a concrete pillar at the mouth of the Kirkop tunnels, having apparently clipped a centre strip and careened across the road. ""Thank God there was nobody on the other lane as the consequences would have been far worse,"" a source close to the investigation told Times of Malta.Â  A passenger in the car was injured and hospitalised after the 9pm accident.Â   And a friend from school, Charlot Spiteri, described him as a person ""with a kind heart and always with a smile on his face"".Â  He was the fourth person to die on Malta's roads so far this year.Â  Italian motorcyclist Danilo De Dominicis was killed on January 23 after crashing into the wall of the Tal-Qroqq tunnels.Â  A 24-year-old pedestrian, Gauri Kumari Baral, died six days after she was hit by a pick up truck on January 6. Malta's first crash victim of the year was Alejandro Brincat, 25, from Mtarfa, who was killed when his car smashed into a tree on the Mdina road in Attard, also on January 6.",11/02/2025,2025-02-10 21:00:00,kirkop tunnels,kirkop,Fatal,24,M,2,Car,,,,,,,,,,,,,,,,20250210,Fatal,2,kirkop,luqa road,evening,False,False,True,False,False,False,False,True,False,False,False,0,1,0,0,0,True,False,False,1,0,0,1,False,False,False,False,True,False,False,0,0,0,0,1,0,0,False,True,True,False,35.8628353,14.498719,primary,False,True,False,False,False,False,South Eastern,False,False,False,True,False
article_3001.0,Motorcyclist hurt in Iklin midnight collision,A motorcyclist was grievously injured in a midnight collision with a car in Iklin on Friday night. The 39-year-old Lija man was riding a Keeway motorbike when he was involved in a crash with a 42-year-old St Paulâ€™s Bay woman driving Toyota Passo. The crash occurred on Triq il-Wied and was reported at midnight. A medical team was called to the scene and took the man to Mater Dei Hospital by ambulance. Doctors there certified his injuries as being of a grievous nature. The police said they are investigating the case.,15/02/2025,2025-02-14 23:45:00,triq il-wied,iklin,Grievious,39,M,1,Motorbike,not injured,42,F,0,Car,,,,,,,,,,,20250214,Grievious,1,iklin,triq il-wied,night,False,False,False,False,False,True,False,False,True,False,False,0,0,2,0,0,True,True,False,1,1,0,2,False,False,False,True,True,False,False,0,0,0,1,1,0,0,False,False,False,True,35.90473,14.45781,residential,False,False,True,False,False,False,Central,True,False,False,False,False
release_41,Traffic accident in Iklin,"Today, at around midnight (0000 hrs), the Police were informed of a traffic accident in Valley Road, Iklin.From preliminary investigations it resulted that a collision occurred between a Toyota Passo driven by a 42-year-old woman from St Paulâ€™s Bay and a Keeway motorcycle driven by a 39-year-old man from Lija.The motorcyclist was assisted by a medical team and taken to Mater Dei Hospital by ambulance. He was later certified to have sustained grievous injuries.The Police are investigating the case.",15/02/2025,2025-02-15 00:00:00,valley road,iklin,not injured,42,F,0,Car,Grievious,39,M,1,Motorbike,,,,,,,,,,,20250215,Grievious,1,iklin,valley road,night,False,False,False,False,False,True,False,False,True,False,False,0,0,2,0,0,True,True,False,1,1,0,2,False,False,False,True,True,False,False,0,0,0,1,1,0,0,True,False,False,False,35.89784,14.49012,secondary,False,False,False,True,False,False,Central,True,False,False,False,False
article_2974.0,Cyclist grievously injured in SiÄ¡Ä¡iewi,"A 50-year-old cyclist was grievously injured when he lost control of his bike and hit a car on Triq il-Kilpa, SiÄ¡Ä¡iewi. The police said the accident was reported on SundayÂ at around 11am. The cyclist, from Mosta, hit a Toyota Vitz driven by a 55-year-old from SiÄ¡Ä¡iewi. He was rushed to Mater Dei.Â  Police investigations are ongoing.",16/02/2025,2025-02-16 11:00:00,triq il-kilpa,siggiewi,Serious,50,M,1,Bicycle,not injured,55,Unknown,0,Car,,,,,,,,,,,20250216,Serious,1,siggiewi,triq il-kilpa,morning,False,False,False,False,True,False,False,False,False,True,False,0,0,0,2,0,True,False,True,1,0,1,2,False,False,True,False,True,False,False,0,0,1,0,1,0,0,True,False,False,False,35.83247,14.43691,residential,False,False,True,False,False,False,Central,True,False,False,False,False
release_48,Traffic accident in Gozo,"Today, at around 1245hrs, the Police were informed of a traffic accident in Giorgio Borg Olivier Street, Victoria, Gozo.The Police went immediately on site and preliminary investigations showed that a Kia Ceed driven by a 21-year-old man residing in Qala, Gozo, overturned after crashing into a wall.A medical team and Civil Protection personnel were called on site to assist, and an ambulance took the man to Gozo General Hospital for treatment. He was later certified with serious injuries.Magistrate Dr Simone Grech LL.D was informed of the case and appointed an inquiry.Police investigations into this incident are ongoing.",17/02/2025,2025-02-17 12:45:00,giorgio borg olivier street,victoria,Serious,21,M,1,Car,,,,,,,,,,,,,,,,20250217,Serious,1,victoria,gorg borg olivier street,afternoon,True,False,False,False,False,False,False,True,False,False,False,0,1,0,0,0,True,False,False,1,0,0,1,False,False,False,False,True,False,False,0,0,0,0,1,0,0,False,False,False,True,36.04447,14.23953,primary,False,True,False,False,False,False,Gozo,False,True,False,False,False
article_2940.0,Three-year-old girl among four injured after car and truck collide,"A three-year-old girl was among four people taken to hospital after a crash between a trailer truck and a car on Ä¦al Far road on Monday afternoon. The accident took place at about 1pm on the road, which is parallel to the airport runway. A man and woman aged 30 and 27 from Marsascala were in the Suzuki Swift car along with the young girl, and the 44-year-old trailer driver, also a Marsascala resident, are being treated at Mater Dei. Transport Malta closed the road in both directions.",17/02/2025,2025-02-17 13:00:00,hal far road,birzebbuga,Unknown,30,M,3,Car,Unknown,44,M,1,Van,,,,,,,,,,,20250217,Serious,4,birzebbuga,hal far road,afternoon,True,False,False,False,False,False,False,False,True,False,False,0,0,2,0,0,True,False,False,2,0,0,2,False,False,False,False,True,True,False,0,0,0,0,1,1,0,False,False,False,True,35.84792,14.5129,primary,False,True,False,False,False,False,South Eastern,False,False,False,True,False
release_42,Car-motorcycle collision,"Yesterday, at around 1800hrs, the Police were informed of a traffic accident in Triq Ä¦ompesch, Fgura.Preliminary investigations showed that a collision occurred between a Chevrolet Aveo that was being driven by a 32-year-old Albanian man from Fgura and a Kawazaki ZR750 motorcycle that was being driven by a 45-year-old Italian man from Marsascala.A medical team was called on site and an ambulance took the motorcyclist to Mater Dei Hospital. He was later certified to have sustained grievous injuries.Police investigations into the accident are ongoing.",20/02/2025,2025-02-19 18:00:00,triq hompesch,fgura,not injured,32,M,0,Car,Grievious,45,M,1,Motorbike,,,,,,,,,,,20250219,Grievious,1,fgura,triq hompesch,afternoon,True,False,False,False,False,False,False,False,True,False,False,0,0,2,0,0,True,False,False,2,0,0,2,False,False,False,True,True,False,False,0,0,0,1,1,0,0,False,False,False,True,35.8723089,14.5218635,primary,False,True,False,False,False,False,South Eastern,False,False,False,True,False
release_17,Traffic accident in Paola,"Two persons were injured in a collision which occurred early this morning in Triq il-BaÄ‹ir, Paola.At around half past seven 0730hrs, when the Police were informed of a traffic accident in which a Toyota Ractis driver, an 80-year-old man from Paola, lost control and crashed into a wall. Another 80-year-old man from Paola was also a passenger in the same vehicle.A medical team was called on site and an ambulance took the two men to Mater Dei Hospital. They were later certified to have sustained grievous injuries.Police investigations into the accident are ongoing.",21/02/2025,2025-02-21 07:30:00,triq il-bacir,paola,Grievious,80,M,2,Car,,,,,,,,,,,,,,,,20250221,Grievious,2,paola,triq il-bacir,early_morning,False,True,False,False,False,False,False,False,False,False,True,0,0,0,0,1,True,False,False,1,0,0,1,False,False,False,False,True,False,False,0,0,0,0,1,0,0,False,False,False,True,35.87541,14.51328,residential,False,False,True,False,False,False,Southern Harbour,False,False,False,False,True
release_19,A collission in Floriana,"A 61-year-old coachman was grievously injured in an accident which occurred at around 1330 hrs in Triq Nazzjonali, Floriana.Preliminary investigations showed that a collision took place between a coachman who resides in Qormi and a Peugeot 508 driven by a 31-year-old man from Cospicua.A medical team was called on site and an ambulance took the man to Mater Dei Hospital. He was later certified to have sustained grievous injuries.Police investigations into the accident are ongoing.",21/02/2025,2025-02-21 13:30:00,triq nazzjonali,floriana,Grievious,61,unknown,1,Bus,not injured,31,unknown,0,Car,,,,,,,,,,,20250221,Grievious,1,floriana,regional road,afternoon,True,False,False,False,False,False,False,False,True,True,False,0,0,1,1,0,False,False,True,0,0,2,2,False,False,False,False,True,False,True,0,0,0,0,1,0,1,False,False,False,True,35.9034355,14.4867323,trunk,False,False,False,False,False,True,Southern Harbour,False,False,False,False,True
article_2792.5,Motorcyclist injured in Hamrun hit-and-run,"A motorcyclist was injured when his motorcycle was allegedly hit by a car which did not stop, the police said. The incident happened just before midnight on Monday as the Suzuki motorcycle was being driven in Triq il-Kappillan Mifsud in Hamrun. The 23-year-old motorcyclist from Sta Venera was assisted by a medical team and hospitalised. The police also reported that earlier on Monday, a man and a woman were hurt when their car crashed into a pole in Triq Marfa, MellieÄ§a. The accident happened at 2.15pm when a Toyota Ractis driven by a 50-year-old woman from Victoria, Gozo, crashed into an electricity pole. The woman and a 29-year-old man who was a passenger were both seriously hurt.",25/02/2025,2025-02-24 14:15:00,triq marfa,mellieha,Serious,50,F,2,Car,,,,,,,,,,,,,,,,20250224,Serious,2,mellieha,triq il-marfa,afternoon,True,False,False,False,False,False,False,False,False,True,False,0,0,0,1,0,False,True,False,0,1,0,1,False,False,False,False,True,False,False,0,0,0,0,1,0,0,False,False,False,True,35.9670439,14.3518793,trunk,False,False,False,False,False,True,Northern,False,False,True,False,False
